Nama Produk,Total Terjual,Total Pendapatan
[COD] Sarung Dewasa Sarung Motif Songket Simple Premium Termurah,3307,230359.065
Sarung Songket Modern Sarung Premium Sarung Dewasa,2478,166668.044
Sarung Dewasa Motif Sabuk Gajah Asia,942,78294.563
Sarung Dewasa Motif Songket Travel Mini Pouch Exclusive,774,74662.522
SMCollection - Sarung Travel Songket Kemasan Pouch,846,71806.744
Sarkoci Anak Sarung Koko Peci Anak Usia 1-14 Tahun,953,53248.648
Sarung Travel Motif Songket Kemasan Pouch Waterproof - Sarung Dewasa Untuk Sholat,213,19052.37
Aljabar Sarung Dewasa Motif Sabuk Palembang Bahan Teteron Cotton Ukuran 125 x 103 cm,63,17434.14
Sarung Dewasa Sarung Tenun Muslim Termurah,137,15386.297
Sarung Tenun Dewasa Sarung Songket Premium Jabar Mosi,79,12893.157
SARUNG TENUN MURAH DEWASA SARUNG DOBY KARAWANG EXPORT QUALITY,81,11674.156
SMCollection - Sarung Tenun Pria Dewasa Motif Songket Kemasan Travel Pouch Lonjong,84,8312.386
COD SORBAN TENUN BERKUALITAS SORBAN ARAB ARAFAT,306,8212.576
Sarung Dewasa Motif Sabuk New Gajah Asia,104,8016.28
Sarung Tenun Dewasa Aljabar Guci,113,7446.201
SMCollection - Sarung Dewasa Motif Sabuk Gajah Mina,43,5410.999
Sarung Instan Anak Karaker Untuk Usia 2-7 Tahun,14,4018.727
COD Sorban Arab Rumbai Motif Diamond Model Segi Empat,44,2263.124
Sarkoci Anak Motif Songket Premium Sarung Koko Peci Anak Usia 1-14 Tahun,41,2217.875
Sarung Anak Laki Laki Usia 4-12 Tahun Al Jabar junior,71,2118.102
Setelan Koko Peci Celana Anak Usia 1-8 Tahun,41,1651.2
Sajadah Kepala Anak Bludru Hitam Ukuran Kecil Motif Kiswah Termurah,4,1335.457
SMCollection - Jubah Gamis Anak Premium Koko Anak Usia 2-9 tahun,23,1307.5
Mukena Travel Mini Pouch Parasut Korea 2 in 1 Free Tasbih Digital,8,946.0
SMCollection Sarung Dewasa Black & White,16,923.151
Sarung Instan Anak Laki Laki Ayo Solat Umur 2-7 Tahun,23,829.315
Sarung Dewasa Aljabar Motif Balimoon Kemasan Mini Pouch Exclusive,2,689.333
Sarung Tenun Aljabar Grey Seris Sarung songket,8,668.429
Sarung anak laki laki umur 4-12 Tahun Motif Matahari,13,626.133
Sarung Tenun Dewasa Aljabar BM Series,8,583.5
Sarung Tenun Santri Motif Saba Sarung Dewasa Muslim,9,579.167
Sarung Dewasa Motif Sabuk Aljabar,14,567.083
Peci Rajut Anak Polos Tebal Elastis / Kopiah Ngaji,17,498.72
Sarung Tenun Dewasa Multazam Salaka Premium,8,448.666
SARUNG TENUN DEWASA BLACK SERIES,1,350.0
Sarung Tenun Dewasa Arzzani Sanmory,7,246.079
Sarung Anak Laki Laki - Sarung Anak Motif Songket,6,206.583
Sarung Anak Travel Friendly Sarung Anak Motif Songket Murah Bersahabat,5,189.0
Sarung anak laki laki usia 4 - 12 Tahun Berbagai Pilihan,5,146.25
Tasbih Digital Mini Alat Hitung Elektronik Finger Tally Counter Mini Jari Penghitung,6,137.587
BOXER PRIA WANITA / CELANA BOXER / CELANA PENDEK / CELANA SARUNG / INNER SARUNG,4,126.85
SARUNG MOISINO MOTIF SABUK RAIBAN POLOS DEWASA TERLARIS,3,113.958
Sarung Dewasa Aljabar Balimoon Eksklusif,2,91.125
Setelan Koko Anak Motif Kotak Tenun Usia 2-9 Tahun,2,88.75
SORBAN ARAFAT MOTIF BINTIK MURAH BERKUALITAS,4,83.125
Pashmina Plisket  Premium Quality Cerutty Babydoll 180 x 75 cm,2,73.5
COD SORBAN HAJI AL-MINA MOTIF RUMBAI OLEH OLEH HAJI,2,62.649
Sarung Anak Black Series Tenun Murah Berkualitas,2,61.25
BERGO PLISKET / BERGO CERUTY PREMIUM HIJAB INSTAN,2,58.333
COD SORBAN ARAB RUMBAI MOTIF OLEH OLEH HAJI DAN UMROH,2,51.25
Arafat Sorban Dewasa Motif Songket Bahan Soft Poly Premium,2,43.333
PASHMINA JERSEY | JERSEY PASHMINA,1,37.762
Sarung Dewasa Sarung Tenun Berkualitas,1,36.75
PASMINA INSTAN INNER 2IN1 | CERUTY BABYDOLL 120CM X 120CM,1,36.0
Celana sarung dewasa - Sarcel dewasa moji,1,34.956
Kopiah Premium Hitam Polos Original / Peci Wadimor Anak dan Dewasa,1,32.0
Sarung Tenun Dewasa Gajah Mina Polos Garis,1,28.833
SORBAN HAJI PUTIH SORBAN ARAFAT MOTIF POLOS TERMURAH,1,11.0
